{
  "version": 1,
  "generatedAt": "2026-09-28T19:38:19.199Z",
  "sets": {
    "CLK": {
      "cardmarket": {
        "expansion": "Pokémon Card Game Classic: Blastoise & Suicune ex Deck",
        "expansionId": null,
        "slug": "Pokemon-Card-Game-Classic-Blastoise-Suicune-ex-Deck",
        "checkedOn": "2026-09-20"
      },
      "pricecharting": {
        "slug": "pokemon-japanese-classic-blastoise",
        "checkedOn": "2026-09-28"
      }
    },
    "M2a": {
      "cardmarket": {
        "expansion": "MEGA Dream ex",
        "expansionId": 6380,
        "slug": "MEGA-Dream-ex",
        "checkedOn": "2026-09-20"
      },
      "pricecharting": {
        "slug": "pokemon-japanese-mega-dream-ex",
        "checkedOn": "2026-09-28"
      }
    },
    "M5": {
      "cardmarket": {
        "expansion": "Abyss Eye",
        "expansionId": 6556,
        "slug": "Abyss-Eye",
        "checkedOn": "2026-09-20"
      },
      "pricecharting": {
        "slug": "pokemon-japanese-abyss-eye",
        "checkedOn": "2026-09-28"
      }
    },
    "M6": {
      "cardmarket": {
        "expansion": "Storm Emeralda",
        "expansionId": 6636,
        "slug": "Storm-Emeralda",
        "checkedOn": "2026-09-20"
      },
      "pricecharting": {
        "slug": "pokemon-japanese-storm-emeralda",
        "checkedOn": "2026-09-28"
      }
    },
    "M6a": {
      "cardmarket": {
        "expansion": "30th Celebration JP",
        "expansionId": 6602,
        "slug": "30th-Celebration-JP",
        "checkedOn": "2026-09-20"
      },
      "pricecharting": {
        "slug": "pokemon-japanese-30th-celebration",
        "checkedOn": "2026-09-28"
      }
    },
    "PMCG1": {
      "cardmarket": {
        "expansion": "Expansion Pack",
        "expansionId": 4169,
        "slug": "Expansion-Pack",
        "checkedOn": "2026-09-20"
      },
      "pricecharting": {
        "slug": "pokemon-japanese-expansion-pack",
        "checkedOn": "2026-09-28"
      }
    },
    "S12a": {
      "cardmarket": {
        "expansion": "VSTAR Universe",
        "expansionId": 5198,
        "slug": "VSTAR-Universe",
        "checkedOn": "2026-09-20"
      },
      "pricecharting": {
        "slug": "pokemon-japanese-vstar-universe",
        "checkedOn": "2026-09-28"
      }
    },
    "S8b": {
      "cardmarket": {
        "expansion": "VMAX Climax",
        "expansionId": 4390,
        "slug": "VMAX-Climax",
        "checkedOn": "2026-09-20"
      },
      "pricecharting": {
        "slug": "pokemon-japanese-vmax-climax",
        "checkedOn": "2026-09-28"
      }
    },
    "SV10": {
      "cardmarket": {
        "expansion": "The Glory of Team Rocket",
        "expansionId": 6092,
        "slug": "The-Glory-of-Team-Rocket",
        "checkedOn": "2026-09-20"
      },
      "pricecharting": {
        "slug": "pokemon-japanese-glory-of-team-rocket",
        "checkedOn": "2026-09-28"
      }
    },
    "SV11W": {
      "cardmarket": {
        "expansion": "White Flare JP",
        "expansionId": 6131,
        "slug": "White-Flare-JP",
        "checkedOn": "2026-09-20"
      },
      "pricecharting": {
        "slug": "pokemon-japanese-white-flare",
        "checkedOn": "2026-09-28"
      }
    },
    "SV1S": {
      "cardmarket": {
        "expansion": "Scarlet ex",
        "expansionId": 5216,
        "slug": "Scarlet-ex",
        "checkedOn": "2026-09-20"
      },
      "pricecharting": {
        "slug": "pokemon-japanese-scarlet-ex",
        "checkedOn": "2026-09-28"
      }
    },
    "SV1V": {
      "cardmarket": {
        "expansion": "Violet ex",
        "expansionId": 5217,
        "slug": "Violet-ex",
        "checkedOn": "2026-09-20"
      },
      "pricecharting": {
        "slug": "pokemon-japanese-violet-ex",
        "checkedOn": "2026-09-28"
      }
    },
    "SV1a": {
      "cardmarket": {
        "expansion": "Triplet Beat",
        "expansionId": 5257,
        "slug": "Triplet-Beat",
        "checkedOn": "2026-09-20"
      },
      "pricecharting": {
        "slug": "pokemon-japanese-triplet-beat",
        "checkedOn": "2026-09-28"
      }
    },
    "SV2D": {
      "cardmarket": {
        "expansion": "Clay Burst",
        "expansionId": 5315,
        "slug": "Clay-Burst",
        "checkedOn": "2026-09-20"
      },
      "pricecharting": {
        "slug": "pokemon-japanese-clay-burst",
        "checkedOn": "2026-09-28"
      }
    },
    "SV2P": {
      "cardmarket": {
        "expansion": "Snow Hazard",
        "expansionId": 5314,
        "slug": "Snow-Hazard",
        "checkedOn": "2026-09-20"
      },
      "pricecharting": {
        "slug": "pokemon-japanese-snow-hazard",
        "checkedOn": "2026-09-28"
      }
    },
    "SV2a": {
      "cardmarket": {
        "expansion": "Pokémon Card 151",
        "expansionId": 5328,
        "slug": "Pokemon-Card-151",
        "checkedOn": "2026-09-20"
      },
      "pricecharting": {
        "slug": "pokemon-japanese-scarlet-&-violet-151",
        "checkedOn": "2026-09-28"
      }
    },
    "SV3": {
      "cardmarket": {
        "expansion": "Ruler of the Black Flame",
        "expansionId": 5409,
        "slug": "Ruler-of-the-Black-Flame",
        "checkedOn": "2026-09-20"
      },
      "pricecharting": {
        "slug": "pokemon-japanese-ruler-of-the-black-flame",
        "checkedOn": "2026-09-28"
      }
    },
    "SV3a": {
      "cardmarket": {
        "expansion": "Raging Surf",
        "expansionId": 5432,
        "slug": "Raging-Surf",
        "checkedOn": "2026-09-23"
      },
      "pricecharting": {
        "slug": "pokemon-japanese-raging-surf",
        "checkedOn": "2026-09-28"
      }
    },
    "SV4a": {
      "cardmarket": {
        "expansion": "Shiny Treasure ex",
        "expansionId": 5519,
        "slug": "Shiny-Treasure-ex",
        "checkedOn": "2026-09-23"
      },
      "pricecharting": {
        "slug": "pokemon-japanese-shiny-treasure-ex",
        "checkedOn": "2026-09-28"
      }
    },
    "SV5K": {
      "cardmarket": {
        "expansion": "Wild Force",
        "expansionId": 5573,
        "slug": "Wild-Force",
        "checkedOn": "2026-09-23"
      },
      "pricecharting": {
        "slug": "pokemon-japanese-wild-force",
        "checkedOn": "2026-09-28"
      }
    },
    "SV5M": {
      "cardmarket": {
        "expansion": "Cyber Judge",
        "expansionId": 5574,
        "slug": "Cyber-Judge",
        "checkedOn": "2026-09-23"
      },
      "pricecharting": {
        "slug": "pokemon-japanese-cyber-judge",
        "checkedOn": "2026-09-28"
      }
    },
    "SV6": {
      "cardmarket": {
        "expansion": "Mask of Change",
        "expansionId": 5690,
        "slug": "Mask-of-Change",
        "checkedOn": "2026-09-23"
      },
      "pricecharting": {
        "slug": "pokemon-japanese-mask-of-change",
        "checkedOn": "2026-09-28"
      }
    },
    "SV7a": {
      "cardmarket": {
        "expansion": "Paradise Dragona",
        "expansionId": 5846,
        "slug": "Paradise-Dragona",
        "checkedOn": "2026-09-23"
      },
      "pricecharting": {
        "slug": "pokemon-japanese-paradise-dragona",
        "checkedOn": "2026-09-28"
      }
    },
    "SV8": {
      "cardmarket": {
        "expansion": "Super Electric Breaker",
        "expansionId": 5901,
        "slug": "Super-Electric-Breaker",
        "checkedOn": "2026-09-23"
      },
      "pricecharting": {
        "slug": "pokemon-japanese-super-electric-breaker",
        "checkedOn": "2026-09-28"
      }
    },
    "SV8a": {
      "cardmarket": {
        "expansion": "Terastal Festival ex",
        "expansionId": 5928,
        "slug": "Terastal-Festival-ex",
        "checkedOn": "2026-09-23"
      },
      "pricecharting": {
        "slug": "pokemon-japanese-terastal-festival",
        "checkedOn": "2026-09-28"
      }
    },
    "SV9": {
      "cardmarket": {
        "expansion": "Battle Partners",
        "expansionId": 5996,
        "slug": "Battle-Partners",
        "checkedOn": "2026-09-23"
      },
      "pricecharting": {
        "slug": "pokemon-japanese-battle-partners",
        "checkedOn": "2026-09-28"
      }
    }
  },
  "cards": {
    "CLK-001": {
      "cardmarket": "https://www.cardmarket.com/en/Pokemon/Products/Singles/Pokemon-Card-Game-Classic-Blastoise-Suicune-ex-Deck/Squirtle-CLK001",
      "pricecharting": "https://www.pricecharting.com/game/pokemon-japanese-classic-blastoise/squirtle-1"
    },
    "M2a-245": {
      "pricecharting": "https://www.pricecharting.com/game/pokemon-japanese-mega-dream-ex/steven%27s-metagross-ex-245"
    },
    "M5-083": {
      "pricecharting": "https://www.pricecharting.com/game/pokemon-japanese-abyss-eye/armarouge-83"
    },
    "M5-084": {
      "pricecharting": "https://www.pricecharting.com/game/pokemon-japanese-abyss-eye/goldeen-84"
    },
    "M5-087": {
      "pricecharting": "https://www.pricecharting.com/game/pokemon-japanese-abyss-eye/slowbro-87"
    },
    "M5-088": {
      "pricecharting": "https://www.pricecharting.com/game/pokemon-japanese-abyss-eye/dhelmise-88"
    },
    "M5-093": {
      "pricecharting": "https://www.pricecharting.com/game/pokemon-japanese-abyss-eye/silvally-93"
    },
    "M5-116": {
      "pricecharting": "https://www.pricecharting.com/game/pokemon-japanese-abyss-eye/gladion's-showdown-116",
      "checkedOn": "2026-09-20",
      "note": "The card at 116 is Gladion’s Showdown; the wishlist calls it \"Gladion\"."
    },
    "M6-080": {
      "pricecharting": "https://www.pricecharting.com/game/pokemon-japanese-storm-emeralda/kyogre-80"
    },
    "M6-084": {
      "pricecharting": "https://www.pricecharting.com/game/pokemon-japanese-storm-emeralda/groudon-84"
    },
    "M6-085": {
      "pricecharting": "https://www.pricecharting.com/game/pokemon-japanese-storm-emeralda/inkay-85"
    },
    "M6-087": {
      "pricecharting": "https://www.pricecharting.com/game/pokemon-japanese-storm-emeralda/altaria-87"
    },
    "M6-088": {